{
  "$schema": "../../schemas/planning-scenarios.schema.json",
  "schemaVersion": 1,
  "slug": "{{slug}}",
  "status": "pending",
  "intakeFingerprint": null,
  "requested": {
    "durationSeconds": null,
    "sceneCount": null
  },
  "commonStory": null,
  "options": [],
  "fingerprint": null,
  "updatedAt": "{{createdAt}}"
}
